{
  "schema_version": 1,
  "status": "active_verified_hash_chain",
  "activation_scope": "child_project",
  "integrity": {
    "mode": "sha256_hash_chain",
    "genesis_hash": "e71007fe4f42051ed2513b8f1fdfbc220571965a02e0d689ff424ee0d1ba37b2",
    "latest_entry_hash": "08c69972715b8914d52f8e463a8537a9694faefe1c0def7c69474db1b4f47ff3",
    "last_verified_at": "2026-10-04T19:12:35Z"
  },
  "entries": [
    {
      "id": "AUDIT-000001",
      "actor_identity_ref": "github-user:wpessential",
      "role": "repository-operator",
      "action": "anpos_child_adoption_merged",
      "target": "Vertex-Systems-Network/vsn-lead-engine",
      "tool_or_provider": "GitHub",
      "base_ref": null,
      "result_ref": "commit:566a93f6456860db1a2e0e3a00f5254d888d7c32 / PR #120",
      "consent_ref": "user instruction: adopt AI-Native blueprint",
      "sanitized_input_hash": null,
      "sanitized_output_or_artifact_hash": null,
      "occurred_at": "2026-10-04T15:30:52Z",
      "result": "success",
      "risk_class": "normal",
      "previous_entry_hash": "e71007fe4f42051ed2513b8f1fdfbc220571965a02e0d689ff424ee0d1ba37b2",
      "entry_hash": "b89835a1a635336e325ba865438cf6a2f10a846234472cad944ffefbd0814695"
    },
    {
      "id": "AUDIT-000002",
      "actor_identity_ref": "github-user:wpessential",
      "role": "repository-operator",
      "action": "main_protection_hardened",
      "target": "ruleset:24086362",
      "tool_or_provider": "GitHub",
      "base_ref": "commit:566a93f6456860db1a2e0e3a00f5254d888d7c32",
      "result_ref": "commit:dda4d0af754db59e67eb83eed2b6eb6f1fa44a8b / PR #122",
      "consent_ref": "user instruction: apply required ANPOS rules",
      "sanitized_input_hash": null,
      "sanitized_output_or_artifact_hash": null,
      "occurred_at": "2026-10-04T18:10:59Z",
      "result": "success",
      "risk_class": "high",
      "previous_entry_hash": "b89835a1a635336e325ba865438cf6a2f10a846234472cad944ffefbd0814695",
      "entry_hash": "b98ab0bfff486584b044bdcc7e8d730fdf1beacf863633ff1fd56c17ac72cb70"
    },
    {
      "id": "AUDIT-000003",
      "actor_identity_ref": "github-user:wpessential",
      "role": "repository-operator",
      "action": "governance_evidence_reconciled",
      "target": "config/github/ruleset-policy.json",
      "tool_or_provider": "GitHub",
      "base_ref": "commit:dda4d0af754db59e67eb83eed2b6eb6f1fa44a8b",
      "result_ref": "commit:ca87ea081c4d461e275aeb720cf7f8cf82ad32cf / PR #123",
      "consent_ref": "user instruction: continue ANPOS implementation",
      "sanitized_input_hash": null,
      "sanitized_output_or_artifact_hash": null,
      "occurred_at": "2026-10-04T18:12:48Z",
      "result": "success",
      "risk_class": "normal",
      "previous_entry_hash": "b98ab0bfff486584b044bdcc7e8d730fdf1beacf863633ff1fd56c17ac72cb70",
      "entry_hash": "5c47e24d748bd158fcae5eb2fe5edc701a26f7b8f0a2878bc8a518c3dc045638"
    },
    {
      "id": "AUDIT-000004",
      "actor_identity_ref": "github-user:wpessential",
      "role": "repository-operator",
      "action": "production_state_reconciled",
      "target": "ANPOS project/execution state",
      "tool_or_provider": "GitHub",
      "base_ref": "commit:ca87ea081c4d461e275aeb720cf7f8cf82ad32cf",
      "result_ref": "commit:ec525a1faac7e4e8b6e736ddc40261bde0275c26 / PR #124",
      "consent_ref": "user instruction: continue P0 reconciliation",
      "sanitized_input_hash": null,
      "sanitized_output_or_artifact_hash": null,
      "occurred_at": "2026-10-04T18:34:00Z",
      "result": "success",
      "risk_class": "normal",
      "previous_entry_hash": "5c47e24d748bd158fcae5eb2fe5edc701a26f7b8f0a2878bc8a518c3dc045638",
      "entry_hash": "c7b1cdc2f9473cf52950a913c1719f2ef9f76082e10790ef95b6716d9527c987"
    },
    {
      "id": "AUDIT-000005",
      "actor_identity_ref": "github-user:wpessential",
      "role": "repository-operator",
      "action": "anpos_assurance_and_governance_hardening_verified",
      "target": "Vertex-Systems-Network/vsn-lead-engine",
      "tool_or_provider": "GitHub",
      "base_ref": "commit:ec525a1faac7e4e8b6e736ddc40261bde0275c26",
      "result_ref": "commit:8922bc8c3e7e331c88e6506625e4d9cca5ea9173 / PRs #125,#127,#129,#130,#131 / ruleset:24086362 / Actions runs 37226403498,37227345426,37227345382",
      "consent_ref": "user instruction: continue until total implementation is complete",
      "sanitized_input_hash": null,
      "sanitized_output_or_artifact_hash": null,
      "occurred_at": "2026-10-04T19:12:35Z",
      "result": "success",
      "risk_class": "high",
      "previous_entry_hash": "c7b1cdc2f9473cf52950a913c1719f2ef9f76082e10790ef95b6716d9527c987",
      "entry_hash": "08c69972715b8914d52f8e463a8537a9694faefe1c0def7c69474db1b4f47ff3"
    }
  ],
  "entry_template": {
    "id": "AUDIT-000001",
    "actor_identity_ref": "",
    "role": "",
    "action": "",
    "target": "",
    "tool_or_provider": null,
    "base_ref": null,
    "result_ref": null,
    "consent_ref": null,
    "sanitized_input_hash": null,
    "sanitized_output_or_artifact_hash": null,
    "occurred_at": null,
    "result": "",
    "risk_class": "normal",
    "previous_entry_hash": null,
    "entry_hash": null
  },
  "rules": {
    "append_or_equivalent_tamper_evident_semantics_required_for_privileged_actions": true,
    "secrets_credentials_and_sensitive_full_prompts_forbidden": true,
    "audit_evidence_is_not_authorization": true,
    "integrity_break_requires_investigation_before_trusting_later_entries": true
  }
}
